105,Kohlrabi mit Pilzragout,Champignon gegart,100,g,100,0,0,Zwiebel,"0,5",Stück,46,0,0,Sonnenblumenöl,"0,5",EL,5,0,0,Jod-Salz,1,Prise,1,0,0,Meersalz,1,Prise,1,0,0,Pfeffer weiß,1,Prise,"0,2",0,0,Thymian,1,Prise,1,0,0,Sherry,10,ml,10,0,0,Crème fraîche (30% Fett),1,EL,15,0,0,Kohlrabi,1,Stück,66,0,0,,0,,0,,,,0,,0,,,,0,,0,,,,0,,0,,,,0,,0,,,,0,,0,,,,0,,0,,,,0,,0,,,,0,,0,,,,0,,0,,,,,,,,,,,,,,,,,,,,,,,,,,,,,,,,,,,,,,,,,,,,,,,,,,,,,,,,,,,,,,,"Zwiebel & Pilze würfeln, Thymian grob hacken. In erhitztem Öl die Thymianblättchen kurz erwärmen, Gemüse zufügen und andünsten. Alles mit Salz und Pfeffer würzen und aus der Pfanne nehmen. Den Bratfond mit Sherry sowie der Crème fraîche erhitzen. Gemüsemasse wieder zugeben, umrühren und bei niedrigster Temperatur warm halten. Salzwasser zum Kochen bringen. Zeitgleich die Kohlrabi schälen, einen Deckel abschneiden und das Innere, bis auf einen 1 cm breiten Rand, aushöhlen. Knollen für 5 Min. und den Deckel für 1 Min. im Salzwasser garen. Nun das Ragout in die abgetropften Kohlrabi geben, den Deckel aufsetzen und servieren.",1,15,0,,,"2,3,4"
106,Zucchiniröllchen mit Spinatfüllung,Zucchini,1,Stück,209,0,0,Quark Magerstufe,125,g,125,0,0,Blattspinat,100,g,100,0,0,Parmesan,50,g,50,0,0,Eier,"0,5",Stück,29,0,0,Jod-Salz,1,Prise,1,0,0,Muskatnuss,1,Prise,"0,2",0,0,Olivenöl,"0,5",EL,5,0,0,Zwiebel,"0,5",Stück,46,0,0,Knoblauchzehe,"0,5",Zehe,"1,5",0,0,Tomatenmark,"0,5",EL,"7,5",0,0,stückige Tomaten,200,g,200,0,0,Wasser,1,TL,5,0,0,Jod-Salz,1,Prise,1,0,0,Thymian,1,Prise,"0,2",0,0,Oregano,1,Prise,"0,2",0,0,geriebener Käse,100,g,100,0,0,Pfeffer,2,Prise,"0,4",0,0,,0,,0,,,,0,,0,,,,,,,,,,,,,,,,,,,,,,,,,,,,,,,,,,,,,,,,,,,,,,,,,,,,,,,,,,,,,,,"Zucchini mit Sparschäler in längliche Scheiben schneiden. Für die Füllung den aufgetauten Spinat ausdrücken und zerkleinern. Quark, Ei, Parmesan und Spinat gut verrühren. Mit Salz, Pfeffer und Muskat abschmecken. Je nach Breite der Zucchinischeiben 1/2 EL Füllung auf eine Scheibe geben und aufrollen. Die Röllchen mit der Nahtseite nach unten in eine Auflaufform geben. Soße: Zwiebel mit dem Knoblauch in Öl glasig werden lassen. Falls noch Zucchinischeiben übrig sind, können diese auch in Würfel geschnitten mitgedünstet werden. Tomatenmark kurz mitrösten. Mit Tomaten ablöschen und  etwas Wasser zugeben. Mit Salz, Pfeffer und Kräutern abschmecken und 5 Min. einkochen. Die Soße abkühlen lassen und über die Zucchiniröllchen geben. 20 Min. im vorgeheizten Ofen bei 180°C garen. Käse darüber geben und 5 Min. überbacken.",1,15,30,,,"2,3"
107,"Upfit ""Gemüse-Geflügelcurry""",Gemüse,200,g,200,0,0,Hähnchen (Brust),100,g,100,0,0,Teriyakisauce,10,ml,10,0,0,Sambal Oelek,"0,5",TL,3,0,0,Curry,"0,5",TL,1,0,0,Gemüse,1,TL,3,0,0,Limette Fruchtsaft,"0,5",EL,"7,5",0,0,Süßstoff (flüssig),"0,5",TL,3,0,0,Wasser,125,ml,125,0,0,,0,,0,,,,0,,0,,,,0,,0,,,,0,,0,,,,0,,0,,,,0,,0,,,,0,,0,,,,0,,0,,,,0,,0,,,,0,,0,,,,0,,0,,,,,,,,,,,,,,,,,,,,,,,,,,,,,,,,,,,,,,,,,,,,,,,,,,,,,,,,,,,,,,,"Aus Teriyaki Soße und Sambal Oelek eine Marinade rühren und 10 Min. Hähnchenbruststreifen darin einlegen. Dabei einmal wenden. Gemüse klein schneiden und in beschichteter Pfanne 3 Min. anbraten. Currypulver darüber stäuben und mit Wasser auffüllen und die granulierte Gemüsebrühe einstreuen. Deckel auf die Pfanne. Weitere Pfanne erhitzen und darin die marinierten Hähnchenstreifen scharf anbraten. Gemüse mit Limettensaft und Süßstoff abschmecken, die gebratenen Hähnchenstreifen zufügen und Petersilie darüber geben.",1,15,0,,,"2,3"
108,Geflügel mit Champignons,Hähnchen (Brust),250,g,250,0,0,Champignon gegart,200,g,200,0,0,Kokosmilch,50,ml,50,0,0,Knoblauchzehe,1,Zehe,3,0,0,Zwiebel,1,Stück,92,0,0,Kokosöl,1,TL,3,0,0,Kräutersalz,1,Prise,1,0,0,Pfeffer,1,Prise,"0,2",0,0,Petersilie,1,Prise,"0,2",0,0,Tomate rot,2,Stück,192,0,0,,0,,0,,,,0,,0,,,,0,,0,,,,0,,0,,,,0,,0,,,,0,,0,,,,0,,0,,,,0,,0,,,,0,,0,,,,0,,0,,,,,,,,,,,,,,,,,,,,,,,,,,,,,,,,,,,,,,,,,,,,,,,,,,,,,,,,,,,,,,,"Hühnerherzen halbieren, Knoblauch und Champignons in feine Scheiben schneiden und Zwiebel würfeln. In einer Pfanne etwas Kokosöl erhitzen und die Hühnerherzen darin anbraten, Knoblauch und Zwiebel dazugeben, 3 Min. schmoren lassen und dann Champignons dazugeben, unter Wenden wieder 3 Min. schmoren lassen. Nun Kokosmilch hinzugeben, alles gut vermischen und bei geschlossenem Deckel weitere 5 Min. schmoren lassen. Mit Kräutersalz und Pfeffer abschmecken. Tomaten vierteln, auf einen Teller legen und mit Kräutersalz würzen, die Hühnerherzen dazugeben und die Petersilie darüber streuen.",1,15,15,,,"2,3"
109,Gemüse-Geflügel-Eintopf,Möhre (Karotte),"1,5",Stück,120,0,0,Hähnchen (Brust),150,g,150,0,0,Zwiebel,"0,5",Stück,46,0,0,Kohlrabi,33,g,33,0,0,Wasser,150,ml,150,0,0,Tomatenmark,"0,5",EL,"7,5",0,0,Jod-Salz,1,Prise,1,0,0,Pfeffer,1,Prise,"0,2",0,0,Gemüsebrühe,1,TL,3,0,0,Lorbeerblatt,"1,5",Stück,0,0,0,Oliven,1,TL,3,0,0,,0,,0,,,,0,,0,,,,0,,0,,,,0,,0,,,,0,,0,,,,0,,0,,,,0,,0,,,,0,,0,,,,0,,0,,,,,,,,,,,,,,,,,,,,,,,,,,,,,,,,,,,,,,,,,,,,,,,,,,,,,,,,,,,,,,,"Hühnerherzen in Topf mit Öl gut anbraten. Anschließend beiseitelegen und gewürfelte Zwiebel leicht anbraten. Nun das zuvor klein geschnittene, restliche Gemüse in Topf geben und bei mittlerer Hitze 15 Min. anbraten. Jetzt heißes Wasser mit der Brühe zugeben. Zwischendurch gut umrühren. Nach 10 Min Hühnerherzen und die Lorbeerblätter dazugeben. Zuletzt noch 60 Min. bei schwacher Hitze köcheln lassen.",1,30,75,,,"2,3"
110,Leckere Kohlrabilasagne,Kohlrabi,"0,5",Stück,33,0,0,Schwein Hackfleisch,125,g,125,0,0,passierte Tomaten,150,g,150,0,,Frischkäse,50,g,50,0,0,Crème fraîche (30% Fett),2,EL,30,0,0,Knoblauchzehe,"0,25",Zehe,1,0,0,geriebener Käse,50,g,50,0,0,Zwiebel,"0,25",Stück,23,0,0,Jod-Salz,1,Prise,1,0,0,Pfeffer,1,Prise,"0,2",0,0,Chilipulver,1,Prise,"0,5",0,0,,0,,0,,,,0,,0,,,,0,,0,,,,0,,0,,,,0,,0,,,,0,,0,,,,0,,0,,,,0,,0,,,,0,,0,,,,,,,,,,,,,,,,,,,,,,,,,,,,,,,,,,,,,,,,,,,,,,,,,,,,,,,,,,,,,,,"Kohlrabi in feine Scheiben schneiden und ca. 13 Min. in Salzwasser kochen. Nun das Hackfleisch in die Pfanne geben und scharf anbraten. Hackfleisch mit den Tomaten ablöschen und kurz aufkochen. Nun den Kräuterfrischkäse hinzugeben und schmelzen lassen. Immer wieder umrühren. Die erste Schicht Kohlrabi in Auflaufform auslegen und den geschmolzenen Frischkäse draufgeben. Anschließend wieder Kohlrabi, dann wieder Hackfleischmasse, usw. bis die Form voll ist. Auf die letzte Schicht zuerst Crème fraîche, dann den Käse geben. Für 20 Min. bei 180 Grad in den Ofen geben, bis der Käse goldbraun ist.",1,35,20,,,"2,3"
111,"Upfit ""Eier-Gemüseschmarrn""",Eier,2,Stück,116,0,0,Frischkäse,70,g,70,0,0,Chiasamen,1,EL,5,0,0,geriebener Käse,50,g,50,0,0,Jod-Salz,1,Prise,1,0,0,Pfeffer,1,Prise,"0,2",0,0,Butter,1,EL,10,0,0,Sellerie,1,Stück,63,0,0,Chicorée,1,Stück,89,0,0,Radieschen,2,Stück,30,0,0,Rucola,10,g,10,0,0,Cocktailtomaten,2,Stück,46,0,0,Schnittlauch,1,TL,4,0,0,,0,,0,,,,0,,0,,,,0,,0,,,,0,,0,,,,0,,0,,,,0,,0,,,,0,,0,,,,,,,,,,,,,,,,,,,,,,,,,,,,,,,,,,,,,,,,,,,,,,,,,,,,,,,,,,,,,,,"Eier und Frischkäse mit einer Gabel verquirlen. Geriebenen Käse, Chia-Samen, Salz und Pfeffer dazugeben und durchrühren. Beiseite stellen. Sellerie in sehr dünne Scheiben, den Chicorée in Streifen, die Radieschen in kleine Würfel und Rucola klein schneiden. Butter in mittelgroßer Pfanne schmelzen lassen und das geschnittene Gemüse dazugeben. Kurz bei mittlerer Hitze anbraten lassen. Eiermasse erneut rühren und langsam von außen nach innen über das Gemüse schütten. Stocken lassen. Zeitgleich die Tomaten würfeln und die Kräuter vorbereiten. Eiermasse in Stücke teilen und umdrehen. Nochmal kurz stocken lassen. Auf Teller geben und die Tomaten und Kräuter darauf verteilen.",1,25,0,,,"2,3"
112,"Upfit ""Mangoldgratin Speciale""",Mangold,"0,5",Stück,500,0,0,Fleischtomate,2,Stück,192,0,0,Schalotte,1,Stück,15,0,0,Knoblauchzehe,2,Stück,6,0,0,Gemüsebrühe,60,ml,60,0,0,Mozzarella,"0,5",Kugel,"62,5",0,0,Parmesan,25,g,25,0,0,Weißbrot,1,Scheibe,30,0,0,Pinienkerne,"0,5",EL,10,0,0,Butter,1,TL,4,0,0,Jod-Salz,1,Prise,1,0,0,"Paprikapulver, edelsüß",1,Prise,"0,2",0,0,Muskatnuss,1,Prise,"0,2",0,0,Pfeffer schwarz,1,Prise,"0,2",0,0,,0,,0,,,,0,,0,,,,0,,0,,,,0,,0,,,,0,,0,,,,0,,0,,,,,,,,,,,,,,,,,,,,,,,,,,,,,,,,,,,,,,,,,,,,,,,,,,,,,,,,,,,,,,,"Mangold mit Stielen in Streifen schneiden & in Pfanne Pinienkerne anrösten & beiseite stellen. Butter schmelzen und Mangold darin schmoren, mit Gemüsebrühe aufgießen und mit geschlossenem Decker 10 Min. garen. Dann abtropfen lassen und in eine feuerfeste Form geben. Etwas Muskat darüber reiben. Tomaten einschneiden, mit kochendem Wasser übergießen, abschrecken und die Haut abziehen. Dann halbieren, entkernen und Fruchtfleisch in Würfel schneiden. Schalotten und Knoblauch schälen und fein hacken. Etwas Butter in Pfanne erhitzen, Schalotten und Knoblauch darin anschwitzen. Tomatenwürfel dazugeben, kurz mitdünsten und mit Salz, Pfeffer und Paprikapulver abschmecken, dann auf das Mangoldgemüse geben. Mozzarella in Würfel schneiden und ebenfalls auf das Mangoldgemüse geben. Weißbrot zerbröseln, mit geriebenem Parmesan mischen und über das Gratin streuen. Butterflöckchen daraufsetzen und 22 Min. in auf 200°C vorgeheizten Ofen backen.",1,20,35,,,"2,3"
113,Pilzpfanne mit Feta,Pilz,125,g,125,0,0,Zwiebel,"0,5",Stück,46,0,0,Chicorée,50,g,50,0,0,Feta,"0,5",Stück,75,0,0,Oregano,20,g,20,0,0,Thymian,20,g,20,0,0,Pfeffer,10,g,10,0,0,Jod-Salz,"0,5",Prise,"0,5",0,0,,0,,0,,,,0,,0,,,,0,,0,,,,0,,0,,,,0,,0,,,,0,,0,,,,0,,0,,,,0,,0,,,,0,,0,,,,0,,0,,,,0,,0,,,,0,,0,,,,,,,,,,,,,,,,,,,,,,,,,,,,,,,,,,,,,,,,,,,,,,,,,,,,,,,,,,,,,,,"Pilze in Scheiben und Chicorée in Stücke schneiden. Feta halbieren. Dann Öl in Pfanne geben und Pilze 5 Min. braten. Stetig rühren und mit Pfeffer & Salz würzen. Zwiebeln dazu und erneut 3 Min. braten. Chicorée kurz mitdünsten lassen und umrühren. Öl in einer weiterer Pfanne erhitzen und den Käse hineingeben. Thymian, Oregano & Pfeffer mischen und auf Käse streuen. Den Käse wenden und erneut mit der Gewürzmischung bestreuen. Käse 5 min. braten - dabei den Käse stetig wenden, bis er auf beiden Seiten gebräunt ist. Zusammen mit der Pilzpfanne servieren.",1,30,10,,,"2,3"
114,"Upfit ""Kraft-Burger""",Rind Hackfleisch,80,g,80,0,0,Zwiebel,"0,25",Stück,23,0,0,Eisbergsalat,1,Blatt,10,0,0,Tomate rot,"0,5",Stück,40,0,0,Cheddar,1,Scheibe,30,0,0,Jod-Salz,1,Prise,1,0,0,Pfeffer,1,Prise,"0,2",0,0,,0,,0,,,,0,,0,,,,0,,0,,,,0,,0,,,,0,,0,,,,0,,0,,,,0,,0,,,,0,,0,,,,0,,0,,,,0,,0,,,,0,,0,,,,0,,0,,,,0,,0,,,,,,,,,,,,,,,,,,,,,,,,,,,,,,,,,,,,,,,,,,,,,,,,,,,,,,,,,,,,,,,"Zwiebel 1cm dicke Ringe schneiden. Einige 6 Ringe wegnehmen und den Rest für die Hackfleischpatties klein hacken. Tomate in Scheiben schneiden. Tipp: Große Tomaten eignen sich am besten. Hack und Zwiebeln vermengen und mit Salz & Pfeffer würzen. Danach Burgerpatties mit der Hand formen. Dann Öl in Pfanne erhitzen und Patties von beiden Seiten anbraten. Kurz vor Ende des Bratvorgangs die Käsescheiben auf die Patties legen und leicht schmelzen. Zeitgleich Blätter des Eisbergsalats abtrennen, da diese als Brötchen dienen. Sobald Patties fertig sind den Burger zusammenstellen, indem Fleisch, Tomaten und Zwiebeln in das Salatblatt gelegt werden.",1,30,15,,,"2,3,4"
115,Überbackenes Geflügel,Hähnchen (Brust),200,g,200,0,0,Tomate rot,1,Stück,96,0,0,Champignon gegart,100,g,100,0,0,Mozzarella,"0,5",Kugel,"62,5",0,0,Jod-Salz,1,Prise,1,0,0,Pfeffer,1,Prise,"0,2",0,0,,0,,0,,,,0,,0,,,,0,,0,,,,0,,0,,,,0,,0,,,,0,,0,,,,0,,0,,,,0,,0,,,,0,,0,,,,0,,0,,,,0,,0,,,,0,,0,,,,0,,0,,,,0,,0,,,,,,,,,,,,,,,,,,,,,,,,,,,,,,,,,,,,,,,,,,,,,,,,,,,,,,,,,,,,,,,"Die Geflügelfilets in Öl anbraten.Dann Tomaten, Champignons und den Mozzarella in feine Scheiben schneiden. Das Geflügel in eine Auflaufform legen, darauf die Tomaten, dann die Champignons und den Mozzarella schichten und mit Salz & Pfeffer würzen. Die Form für 15 Min bei 200°C in den vorgeheizten Ofen schieben, bis der Käse verlaufen ist und die gewünschte Bräunung erreicht hat. Fertig. Guten Appetit!",1,25,0,,,"2,3"
116,"Upfit ""Hähnchen-Zucchiniauflauf""",Hähnchen (Brust),150,g,150,0,0,Zucchini,1,Stück,209,0,0,Zwiebel,1,Stück,92,0,0,Knoblauchzehe,"0,5",Zehe,"1,5",0,0,Crème fraîche (30% Fett),2,EL,30,0,0,Eier,"0,5",Stück,29,0,0,Zitrone,1,Scheibe,10,0,0,Olivenöl,"0,5",EL,5,0,0,Mozzarella,"0,5",Kugel,"62,5",0,0,Basilikum,1,TL,2,0,0,Jod-Salz,1,Prise,1,0,0,Feta,25,g,25,0,0,Pfeffer,1,Prise,"0,2",0,0,,0,,0,,,,0,,0,,,,0,,0,,,,0,,0,,,,0,,0,,,,0,,0,,,,0,,0,,,,,,,,,,,,,,,,,,,,,,,,,,,,,,,,,,,,,,,,,,,,,,,,,,,,,,,,,,,,,,,"Geflügelfilets in kleine Stücke schneiden und in Öl anbraten. Danach Zucchini zerkleinern und mit der zerkleinerten Zwiebel anbraten. Alles zusammengeben und nochmal alles leicht braten. Knoblauch pressen und mit Salz 5 Min. ziehen lassen. Alles in der Pfanne mit Basilikum, Salz und Pfeffer würzen. Dann den Knoblauch dazugeben. Crème fraîche dazugeben, gut umrühren und bei leichter Hitze braten. Das Ei trennen und das Eigelb hineinrühren (Eiweiß wird nicht benötigt). Bei Bedarf nachwürzen. Alles in Backform geben und mit geriebenem Mozzarella bestreuen. Nun kann es bei 200°C für 12 Min. in den Ofengeben. Fertig.",1,15,30,,,"2,3"
117,Zucchininudeln à la Turk,Zucchini,3,Stück,627,0,,Joghurt,250,g,250,0,0,Tomatenmark,4,EL,60,0,0,Rapsöl,5,EL,50,0,0,Jod-Salz,1,Prise,1,0,0,Knoblauchpulver,1,Prise,"0,2",0,0,Wasser,3,EL,30,0,0,,0,,0,,,,0,,0,,,,0,,0,,,,0,,0,,,,0,,0,,,,0,,0,,,,0,,0,,,,0,,0,,,,0,,0,,,,0,,0,,,,0,,0,,,,0,,0,,,,0,,0,,,,,,,,,,,,,,,,,,,,,,,,,,,,,,,,,,,,,,,,,,,,,,,,,,,,,,,,,,,,,,,"Zucchini in feine ""Spaghetti""-Streifen schneiden. Streifen in Pfanne mit dem Wasser auf niedriger Stufe dämpfen. Zeitgleich Öl erhitzen und Tomatenmark vorsichtig darin anbraten. Nun nur noch den Joghurt mit Knoblauch und Salz würzen. Auf dem Teller die Zucchini anrichten, darauf den Joghurt verteilen und zum Schluss noch das Tomatenmark mit Teilen vom Öl darauf geben. Fertig. Lass es Dir schmecken!",1,10,10,,,"2,3"
118,Zucchini-Thunfisch Pizza,Zucchini,125,g,125,0,0,Thunfisch Konserve,"0,5",Dose,93,0,0,Eier,1,Stück,58,0,0,Zwiebel,"0,25",Stück,23,0,0,Knoblauchzehe,"0,5",Zehe,"1,5",0,0,geriebener Käse,35,g,35,0,0,Tomatenmark,1,TL,5,0,0,Jod-Salz,1,Prise,1,0,0,Pfeffer,1,Prise,"0,2",0,0,Oregano,1,Prise,"0,2",0,0,,0,,0,,,,0,,0,,,,0,,0,,,,0,,0,,,,0,,0,,,,0,,0,,,,0,,0,,,,0,,0,,,,0,,0,,,,0,,0,,,,,,,,,,,,,,,,,,,,,,,,,,,,,,,,,,,,,,,,,,,,,,,,,,,,,,,,,,,,,,,"Zucchini grob reiben, salzen und stehen lassen. Den Backofen auf 180°C vorheizen. Die Zwiebel würfeln & die Knoblauchzehen schälen und pressen. Die Zucchini gut ausdrücken, Flüssigkeit abgießen, auch den Thunfisch abtropfen lassen. Alles mit Ei vermengen und gut durchkneten, mit Salz und Pfeffer kräftig würzen. Die breiige Masse auf Backblech mit Backpapier geben und im vorgeheizten Backofen für 12 Min. bei 180° backen. Danach den ""Pizzaboden"" aus dem Ofen nehmen und mit Tomatenmark bestreichen. Mit Salz, Pfeffer und Oregano würzen, mit übrigen Zutaten belegen und mit Käse bestreuen. Dann die Pizza wieder in den Ofen geben und 20 Min. backen. Guten Appetit!",1,25,35,,,"2,3"
119,"Upfit ""Zucchini-Pasta mit Hack""",Rind Hackfleisch gegart,125,g,125,0,0,Zwiebel,"0,25",Stück,23,0,0,Jod-Salz,1,Prise,1,0,0,"Kräuter (TK, italienisch)",1,EL,4,0,0,passierte Tomaten,125,g,125,0,0,Tomatenmark,"0,75",EL,"11,3",0,0,Gemüsebrühe,"0,25",TL,4,0,0,"Paprikapulver, edelsüß",1,Prise,"0,2",0,0,Zucchini,"0,5",Stück,"104,5",0,0,Crème fraîche (30% Fett),50,g,50,0,0,geriebener Käse,50,g,50,0,0,Pfeffer,1,Prise,"0,2",0,0,,0,,0,,,,0,,0,,,,0,,0,,,,0,,0,,,,0,,0,,,,0,,0,,,,0,,0,,,,0,,0,,,,,,,,,,,,,,,,,,,,,,,,,,,,,,,,,,,,,,,,,,,,,,,,,,,,,,,,,,,,,,,"Zwiebelwürfeln mit Öl in Pfanne braten. Dann das Hack hinzufügen und ebenfalls braten. Nun das Hack mit Salz & Pfeffer würzen und die italienischen Kräuter hinzufügen. Passierte Tomaten und Tomatenmark in die Pfanne geben, mit Brühe und Paprika würzen & mit Salz & Pfeffer abschmecken. Die Enden der Zucchini Enden abschneiden & mit einem Hobel längs in dünne ""Spaghetti""-Scheiben schneiden. Zucchini, Créme fraîche und Tomaten-Hackfleisch-Soße abwechselnd in eine Auflaufform schichten. Die Zucchinischeiben dünn mit Creme fraîche bestreichen. Die letzte Schicht besteht aus Zucchini und Créme fraîche. Nun den geriebenen Käse darüber streuen. Lasagne bei 200 °C ca. 35 Min. im Ofen garen.",1,20,40,,,"2,3"
120,Feuriges Geflügelchili,Hähnchen (Brust),200,g,200,0,0,Paprika rot,"0,25",Stück,"38,75",0,0,Paprika gelb,"0,25",Stück,"38,75",0,0,Möhre (Karotte),"0,5",Stück,40,0,0,Zwiebel,"0,25",Stück,23,0,0,Knoblauchzehe,"0,25",Zehe,"0,75",0,0,Sellerie,"0,5",Stück,32,0,0,stückige Tomaten,125,g,125,0,0,passierte Tomaten,"0,25",Packung,125,0,0,Chilipulver,"0,25",TL,"0,5",0,0,Paprikapulver,"0,25",TL,"0,5",0,0,Kreuzkümmel,"0,25",TL,"0,5",0,0,Cayennepfeffer,1,Prise,"0,2",0,0,Lorbeerblatt,1,Stück,"0,2",0,0,Hühnerbrühe/- boullion gekörnt,50,ml,50,0,0,Jod-Salz,1,Prise,1,0,0,Rapsöl,1,TL,3,0,0,Pfeffer,1,Prise,"0,2",0,0,,0,,0,,,,0,,0,,,,,,,,,,,,,,,,,,,,,,,,,,,,,,,,,,,,,,,,,,,,,,,,,,,,,,,,,,,,,,,"Hackfleisch 3 Min. mit Öl in Topf anbraten, salzen & pfeffern. Dann in eine Schüssel geben und warm stellen. Hitze reduzieren und Paprika, Karotten, Zwiebeln, Sellerie und Knoblauch im Topf 4Min. braten, Gewürze dazu geben und 1 Min. braten. Hitze erhöhen und die Tomatenstücke, passierten Tomaten, Hühnerbrühe und Lorbeerblatt dazugeben. Kurz aufkochen lassen und alles bei geringer Hitze 15 Min köcheln. Am Ende Hackfleisch dazugeben und weitere 5 Min. köcheln.Tipp: Vor dem Servieren das Lorbeerblatt entfernen. Fertig. Guten Appetit!",1,30,0,,,"2,3,4"
121,"Upfit ""Gefüllte Zucchini""",Zucchini,250,g,250,0,0,Putenhackfleisch,125,g,125,0,0,Champignon gegart,75,g,75,0,0,Tomate rot Konserve,"0,5",Dose,200,0,0,Zwiebel,"0,5",Stück,46,0,0,Knoblauchzehe,"0,5",Zehe,"1,5",0,0,Petersilie,1,TL,2,0,0,Jod-Salz,1,Prise,1,0,0,Gemüsebrühe,1,TL,3,0,0,geriebener Käse,50,g,50,0,0,Pfeffer,1,Prise,"0,2",0,0,,0,,0,,,,0,,0,,,,0,,0,,,,0,,0,,,,0,,0,,,,0,,0,,,,0,,0,,,,0,,0,,,,0,,0,,,,,,,,,,,,,,,,,,,,,,,,,,,,,,,,,,,,,,,,,,,,,,,,,,,,,,,,,,,,,,,"Zucchini halbieren und aushöhlen.Hackfleisch mit Zwiebeln und Knoblauch vermischen, Gemüsebrühe, Salz, Pfeffer und Kräuter hinzugeben. In wenig Öl anbraten.Das Hackfleisch in die ausgehöhlten Zucchini füllen, in eine Auflaufform geben und mit Käse bestreuen. Im Backofen bei 180 °C ca. 25 Min. garen. Fertig. Lass es Dir schmecken.",1,15,0,,,"2,3,4"
122,"Upfit ""Gefüllte Kohlrabi""",Kohlrabi,1,Stück,66,0,0,Schwein Hackfleisch,125,g,125,0,0,Zwiebel,"0,5",Stück,46,0,0,Rapsöl,1,TL,10,0,0,Tomate rot,"1,5",Stück,144,0,0,Tomatenmark,2,EL,30,0,0,Sahne,1,EL,13,0,0,Frischkäse,1,EL,12,0,0,Gemüsebrühe,1,TL,3,0,0,Jod-Salz,1,Prise,1,0,0,Paprikapulver,1,Prise,"0,2",0,0,Pfeffer,1,Prise,"0,2",0,0,,0,,0,,,,0,,0,,,,0,,0,,,,0,,0,,,,0,,0,,,,0,,0,,,,0,,0,,,,0,,0,,,,,,,,,,,,,,,,,,,,,,,,,,,,,,,,,,,,,,,,,,,,,,,,,,,,,,,,,,,,,,,"Kohlrabi schälen und in Topf mit Brühe 15 Min kochen. Kohlrabi mit Löffel aushöhlen. In einer Pfanne die klein geschnittenen Zwiebeln im Öl anbraten, Hack dazu geben, würzen und mit der Hälfte des Tomatenmark verrühren. Zeitgleich Backofen auf 200°C vorheizen. Kohlrabi in Auflaufform geben, Tomaten stückeln und mit den Kohlrabiresten um die Kohlrabi verteilen. Die Hackmasse in die Kohlrabi füllen, aus dem Frischkäse eine Haube darauf setzen. Restliche Brühe in die Auflaufform geben. Jetzt restliches Tomatenmark mit Sahneersatz und etwas Wasser vermengen bis eine cremige Konsistenz erreicht wird. Nachwürzen und über die Tomaten-Kohlrabistückchen geben. Fertig.",1,20,0,,,"2,3,4"
123,Kohlrabispaghetti mit Veggie-Bolgnese,Kohlrabi,1,Stück,66,0,0,Sojagranulat,40,g,40,0,0,Zwiebel,"0,5",Stück,46,0,0,Möhre (Karotte),"0,5",Stück,40,0,0,Parmesan,15,g,15,0,0,Tomaten (Konserve),"0,5",Dose,200,0,0,Jod-Salz,1,Prise,1,0,0,,0,,0,0,0,Oregano,1,Prise,"0,2",0,0,Tomatenmark,"0,5",EL,"7,5",0,0,Pfeffer,1,Prise,"0,2",0,0,,0,,0,,,,0,,0,,,,0,,0,,,,0,,0,,,,0,,0,,,,0,,0,,,,0,,0,,,,0,,0,,,,0,,0,,,,,,,,,,,,,,,,,,,,,,,,,,,,,,,,,,,,,,,,,,,,,,,,,,,,,,,,,,,,,,,Sojagranulat in kochender Brühe 10 Min. einweichen und gut ausdrücken. Jetzt scharf anbraten und ordentlich würzen & gewrüfelte Zwiebel dazu geben. Klein geraspelte Möhre dazu und das Tomatenmark einrühren. Kurz anschwitzen und dann mit den Tomaten ablöschen. Mit Oregano abschmecken und ein paar Minuten weiter köcheln. Den Kohlrabi schälen und mit einem Sparschäler in feine Streifen schneiden. Diese in kochender Brühe 7 Min. kochen. Kohlrabi abtropfen lassen und dann mit der Soße und dem Parmesan anrichten. Fertig!,1,30,20,,,"2,3"
124,Rinderfilet mit Blumenkohlpüree und Zucchini - Pilz - Pfanne,Rind Filet,1,Stück,250,0,0,Blumenkohl,"0,5",Stück,31,0,0,,,,,,,Zucchini,"0,5",Stück,"52,25",0,0,Champignon gesalzen,150,g,150,0,0,Frühlingszwiebel,2,Stück,90,0,0,Jod-Salz,1,Prise,1,0,0,Butter,"0,5",EL,5,0,0,Olivenöl,1,TL,3,0,0,Muskatnuss,1,Prise,"0,2",0,0,"Paprikapulver, edelsüß",1,Prise,"0,2",0,0,Chilipulver,1,Prise,"0,2",0,0,Balsamico,1,TL,5,0,0,Knoblauchzehe,"1,5",Zehe,"4,5",0,0,Pfeffer,1,g,"0,2",0,0,,0,,0,,,,0,,0,,,,0,,0,,,,0,,0,,,,0,,0,,,,,,,,,,,,,,,,,,,,,,,,,,,,,,,,,,,,,,,,,,,,,,,,,,,,,,,,,,,,,,,"Blumenkohl in größere Röschen teilen. In Salzwasser ca. 20 Minuten kochen. Jetzt Champignons halbieren, Zucchini in mundgerechte Stücke und die Frühlingszwiebeln in 2 cm lange Stücke schneiden (auch das essbare Grüne verwenden). Öl in Pfanne erhitzen und Fleisch in die Pfanne geben und anbraten, salzen, pfeffern und mit Paprikapulver würzen. Das geschnittene Gemüse und den Knoblauch in zweiter Pfanne scharf anbraten, salzen, pfeffern und mit Paprikapulver und Chili würzen. Mit einem sehr großzügigen Schuss Balsamico ablöschen. Blumenkohl abtropfen lassen, in eine Schüssel geben und pürieren. Die Butter zugeben, mit Salz, Pfeffer und ein wenig Muskat würzen.Fertig. Guten Appetit.",1,15,0,,,"2,3"
125,Upfit Steckrüben-Püree,Steckrübe,150,g,150,0,0,Butterschmalz,1,TL,4,0,0,Jod-Salz,1,Prise,1,0,0,Muskatnuss,1,Prise,"0,2",0,0,,0,,0,0,0,Wasser,1,TL,5,0,0,Pfeffer,1,Prise,"0,2",0,0,,0,,0,,,,0,,0,,,,0,,0,,,,0,,0,,,,0,,0,,,,0,,0,,,,0,,0,,,,0,,0,,,,0,,0,,,,0,,0,,,,0,,0,,,,0,,0,,,,0,,0,,,,,,,,,,,,,,,,,,,,,,,,,,,,,,,,,,,,,,,,,,,,,,,,,,,,,,,,,,,,,,,"Steckrüben würfeln und in etwas Butterschmalz angebraten, bis sie beginnen braun zu werden. Nun etwas Wasser hinzu geben und Steckrüben garen bis sie weich sind. Am Ende der Garzeit sollte sich so gut wie kein Wasser mehr im Topf befinden. Nun mit einer Prise Salz, Pfeffer und Muskat abschmecken. Danach die Steckrüben pürieren. Fertig ist das Steckrübenpüree. Guten Appetit.",1,20,0,,,"2,3"
126,Leckeres Hähnchencurry,Hähnchen (Brust),125,g,125,0,0,Kokosmilch,100,ml,100,0,0,Sojasauce,"0,5",EL,"7,5",0,0,Currypaste,"0,5",TL,3,0,0,Frühlingszwiebel,"1,25",Stück,68,0,0,Paprika rot,"0,5",Stück,"77,5",0,0,Bambussprossen,100,g,100,0,0,Knoblauchzehe,"0,25",Zehe,"0,75",0,0,Jod-Salz,1,Prise,1,0,0,Pfeffer,1,Prise,"0,2",0,0,,0,,0,,,,0,,0,,,,0,,0,,,,0,,0,,,,0,,0,,,,0,,0,,,,0,,0,,,,0,,0,,,,0,,0,,,,0,,0,,,,,,,,,,,,,,,,,,,,,,,,,,,,,,,,,,,,,,,,,,,,,,,,,,,,,,,,,,,,,,,"Fleisch in mundgerechte Stücke schneiden, Paprika und Frühlingszwiebeln ebenfalls klein schneiden & den Knoblauch hacken. Nun die Currypaste im Wok anbraten. Fleisch hineingeben und mitbraten. Wenn das Fleisch Farbe bekommen hat, das Gemüse und den Knoblauch hinzufügen und andünsten. Nun mit Kokosmilch ablöschen und etwas eindicken lassen, nach Bedarf Sojasauce hinzufügen. Danach mit den Gewürzen abschmecken. Fertig.",1,15,30,,,"2,3"
127,Hack-Brokkoli-Pfanne ,Rind Hackfleisch,200,g,200,0,0,Currypaste,1,TL,6,0,0,Jod-Salz,"0,5",TL,"2,5",0,0,Koriander,"0,5",TL,1,0,0,Broccoli,1,Stück,340,0,0,Ingwerknolle,20,g,20,0,0,getrocknete Tomate (in Öl),50,g,50,0,0,Mandelmus,1,EL,12,0,0,Zitrone Fruchtsaft,1,EL,15,0,0,Wasser,150,ml,150,0,0,,0,,0,,,,0,,0,,,,0,,0,,,,0,,0,,,,0,,0,,,,0,,0,,,,0,,0,,,,0,,0,,,,0,,0,,,,0,,0,,,,,,,,,,,,,,,,,,,,,,,,,,,,,,,,,,,,,,,,,,,,,,,,,,,,,,,,,,,,,,,"Hackfleisch in einer Wok-Pfanne zusammen mit Salz, Koriander und roter Currypaste anbraten. Den Brokkoli waschen, in kleine Röschen schneiden und in die Pfanne geben. Ca. 10 Min. auf höchster Stufe abgedeckt garen und gelegentlich umrühren. Den Ingwer schälen und in feine Würfel schneiden. Die getrockneten Tomaten in Streifen schneiden. Ingwer, getrocknete Tomaten, grobes Mandelmus, Zitronensaft oder Apfelessig und Wasser in die Pfanne geben und gut verrühren. Noch einmal abschmecken und servieren. Fertig. Guten Appetit!",1,10,15,,,"2,3"
128,Eisbergsalat mit Hackfleisch,Eisbergsalat,"0,5",Stück,80,0,0,Zwiebel,"0,5",Stück,46,0,0,Gewürzgurken Sauerkonserve,"1,5",Stück,100,0,0,Schmelzkäse,1,Scheibe,30,0,0,Rind Hackfleisch,100,g,100,0,0,Olivenöl,"0,5",EL,5,0,0,Pfeffer,1,Prise,"0,2",0,0,Jod-Salz,1,Prise,1,0,0,Mayonnaise,"1,5",EL,18,0,0,Tomatenmark,"0,5",EL,"7,5",0,0,,,,,,,Essig,"0,5",EL,"7,5",0,0,,0,,0,,,,0,,0,,,,0,,0,,,,0,,0,,,,0,,0,,,,0,,0,,,,0,,0,,,,0,,0,,,,,,,,,,,,,,,,,,,,,,,,,,,,,,,,,,,,,,,,,,,,,,,,,,,,,,,,,,,,,,,"Eisbergsalat zerpflücken und auf den Tellern anrichten. Die Zwiebel in Ringe schneiden und mit dem Hackfleisch in einer Pfanne anbraten. Das Hackfleisch so klein wie möglich zerdrücken und mit Salz & Pfeffer würzen. Die Gruken in Scheiben geschnitten und den Schmelzkäse zerpflückt auf dem Salat verteilen. Sobald das Hackfleisch gar ist auf dem Käse verteilen, damit dieser schmelzen kann. Aus den restlichen Zutaten eine Cocktailsoße herstellen. Diese noch mit Pfeffer und Salz würzen.",1,15,5,,,"2,3,4"
