233,vegetarischer Couscous,Couscous,90,g,90,0,0,Zucchini gegart,1,Stück,209,0,0,Tomate rot,1,Stück,96,0,0,Lauchzwiebel,2,Stück,90,0,0,Walnuss,5,g,5,0,0,grüne Peperoni (roh),"1,5",Stück,20,0,0,Gemüsebrühe,250,ml,250,0,0,Paprika-Gewürz,"0,5",TL,"0,5",0,0,Jod-Salz,1,Prise,1,0,0,Schmand,2,EL,30,0,0,Pfeffer,1,Prise,"0,2",0,0,,0,,0,,,,0,,0,,,,0,,0,,,,0,,0,,,,0,,0,,,,0,,0,,,,0,,0,,,,0,,0,,,,0,,0,,,,,,,,,,,,,,,,,,,,,,,,,,,,,,,,,,,,,,,,,,,,,,,,,,,,,,,,,,,,,,,"Couscous in einer Schüssel mit kochendem Wasser übergießen (Couscous soll mit Wasser bedeckt sein), abdecken und 10 Min. quellen lassen, dann umrühren. Zeitgleich frische Zutaten klein schneiden & Gemüsebrühe zum Kochen bringen. Tomaten, Lauchwiebeln und Zucchini in Gemüsebrühe geben und darin kochen, bis das Gemüse bissfest ist. Gemüse abseihen, zum Couscous in die Schüssel geben und vermengen. Nun Walnüsse und Peperoni dazu geben und mit Salz, Pfeffer und Chilipaste abschmecken. Zum Couscous auf dem Teller etwas Schmand geben.",1,20,0,,,"2,3"
234,Geflügel mit Couscous & mehr,Zwiebel,"0,5",Stück,46,0,0,Knoblauchzehe,"0,5",Zehe,"1,5",0,0,Hokkaido (Kürbis),125,g,125,0,0,Süßkartoffel,125,g,125,0,0,Hähnchen (Brust),180,g,180,0,0,Olivenöl,1,TL,3,0,0,Gemüsebrühe,250,ml,250,0,0,Tomatenmark,1,TL,5,0,0,Zimt,"0,5",TL,1,0,0,Rosinen,"0,5",EL,"7,5",0,0,Kichererbsen,75,g,75,0,0,Jod-Salz,1,Prise,1,0,0,Pfeffer,1,Prise,"0,2",0,0,Chilipulver,1,Prise,"0,2",0,0,Knoblauchzehe,"0,5",Stück,"1,5",0,0,Koriander,"0,5",TL,1,0,0,Kreuzkümmel,1,Prise,"0,2",0,0,Couscous,75,g,75,0,0,,,,,,,,,,,,,,,,,,,,,,,,,,,,,,,,,,,,,,,,,,,,,,,,,,,,,,,,,,,,,,,,,,,,,,,,,"Zwiebeln und Knoblauch würfeln, Süßkartoffeln schälen und mit dem Kürbis in 2 cm dicke Würfel schneiden. Geflügel in Öl in einer Pfanne 4 Min. braten. Zwiebeln und Knoblauch hinzufügen und 2 Min. glasig anbraten. Tomatenmark und Pfeffer unterrühren. Gemüsebrühe angießen und alles 10 Min. zugedeckt köcheln lassen. Süßkartoffeln zum Geflügel geben und 10 Min. garen. Nun Kürbiswürfel und Kichererbsen untermischen. Zimt und Rosinen unterheben. Wenn der Kürbis gar ist, alles mit Salz & Pfeffer abschmecken. Salzwasser in einen Topf aufkochen, Couscous hingeben, Temperatur reduzieren und gar quellen lassen. Auf Teller Gemüse um den Couscous schichten, Filets auf den Couscous legen und mit Brühe begießen. Korianderblättchen auf das Gericht streuen.",1,45,0,,,"2,3"
235,orientalischer Couscous-Salat,Couscous,40,g,40,0,0,Orange Fruchtsaft,20,ml,20,0,0,Zwiebel,"0,2",Stück,18,0,0,Zucchini,"0,2",Stück,"41,8",0,0,Paprikaschote gegart,"0,2",Stück,35,0,0,Feige,100,g,80,0,0,Honig,"0,5",TL,5,0,0,Pfefferminze (roh),1,Blatt,"0,2",0,0,Jod-Salz,1,Prise,1,0,0,Kreuzkümmel,"0,5",TL,1,0,0,Curry,1,Prise,"0,2",0,0,Kurkuma,1,Prise,"0,5",0,0,Olivenöl,1,TL,3,0,0,Pfeffer,1,Prise,"0,2",0,0,,0,,0,,,,0,,0,,,,0,,0,,,,0,,0,,,,0,,0,,,,0,,0,,,,,,,,,,,,,,,,,,,,,,,,,,,,,,,,,,,,,,,,,,,,,,,,,,,,,,,,,,,,,,,"Couscous nach Packungsanleitung zubereiten, dabei die Hälfte der angegebenen Flüssigkeitsmenge durch Orangensaft ersetzen. Wenn Couscous ausgequollen ist, zum Abkühlen in eine große Schüssel geben und immer wieder mit zwei Gabeln auflockern, damit nichts klumpt. 
 Die Zucchini waschen und in kleine Würfel schneiden. Dann in etwas Olivenöl leicht anbraten und zu dem Couscous geben. Die klein geschnittene Zwiebel ebenfalls leicht anbraten und dann mit dem Honig glasieren. Wenn der Honig geschmolzen ist und kleine Blasen wirft, vom Herd nehmen und zu dem Salat geben. 
 Dann die klein geschnittene Paprika und die ebenfalls zerkleinerten Soft-Früchte hinzugeben und gut vermengen. 
 Die Pfefferminzblätter gut waschen, trocken tupfen, klein hacken und ebenfalls mit zum Salat geben. 
 
 Den Couscous-Salat mit orientalischen Gewürzen abschmecken. Da ich persönlich nichts davon halte mir extra nur für ein Rezept ein ganz spezielles Gewürz zuzulegen was ich sonst nie brauche sind die oben aufgeführten Gewürze nur ein Vorschlag von mir (so wie ich den Salat halt mache). Schaut einfach in euren Gewürzschrank was gut passen würde - ich empfehle hier eher eine herbe Auswahl zu treffen, da das einen schönen Kontrast zu der Süße von Honig und Soft-Früchten gibt. 
 Anschließend noch ca. 6 EL Olivenöl hinzugeben und alles gut vermengen. 
 
 Der Salat hat eine fruchtig-herbe Note und passt (nicht nur) gut zu Gegrilltem.",1,30,0,,,"2,3"
236,vegetarisches Gemüse-Couscous,Frühlingszwiebel,"0,5",Stück,43,0,0,Möhre (Karotte),"0,25",Stück,20,0,0,Zucchini,"0,25",Stück,"52,25",0,0,Paprika rot,"0,5",Stück,"77,5",0,0,Cocktailtomaten,2,Stück,46,0,0,Ingwer,2,Prise,"0,5",0,0,Kurkuma,1,Prise,"0,2",0,0,Knoblauchzehe,"0,25",Zehe,1,0,0,Jod-Salz,1,Prise,1,0,0,Olivenöl,2,TL,6,0,0,Couscous,30,g,30,0,0,Pfeffer,1,Prise,"0,2",0,0,,0,,0,,,,0,,0,,,,0,,0,,,,0,,0,,,,0,,0,,,,0,,0,,,,0,,0,,,,0,,0,,,,,,,,,,,,,,,,,,,,,,,,,,,,,,,,,,,,,,,,,,,,,,,,,,,,,,,,,,,,,,,"Lauchzwiebeln in Ringe schneiden, Zucchini und Möhre mit hobeln, Paprika entkernen und in 1 cm große Würfel schneiden. Tomaten längs halbieren. Öl in der Pfanne auf höchster Stufe erhitzen. Das Gemüse (außer den Tomaten) darin scharf anbraten. Knoblauchzehe in die Pfanne drücken, den geriebenen Ingwer dazugeben. Mit Salz, Pfeffer und Kurkuma würzen. Couscous nach Anleitung zubereiten. Nun mit Tomaten zum Gemüse in die Pfanne geben und 1 Min. bei großer Hitze erwärmen. Fertig.",1,20,0,,,"2,3"
237,Rote Beete Carpaccio mit Salat,Kürbiskerne,1,EL,12,0,0,Zucker,1,EL,15,0,0,Butter,1,TL,4,0,0,Olivenöl,5,ml,5,0,0,Feldsalat,50,g,50,0,0,Birne,"0,5",Stück,45,0,0,Butter,5,g,5,0,0,Rote Beete,50,g,50,0,0,Schinkenwürfel,15,g,15,0,0,Schalotte,"0,5",Stück,"7,5",0,0,Balsamico,1,TL,5,0,0,Honig,1,g,1,0,0,Senf,1,g,1,0,0,Jod-Salz,1,Prise,1,0,0,Kürbiskernöl,4,TL,12,0,0,Pfeffer,1,Prise,"0,2",0,0,,0,,0,,,,0,,0,,,,0,,0,,,,0,,0,,,,,,,,,,,,,,,,,,,,,,,,,,,,,,,,,,,,,,,,,,,,,,,,,,,,,,,,,,,,,,,"Kürbiskerne in Pfanne trocken rösten, herausnehmen, beiseite stellen. Alufolie mit Öl bestreichen. Zucker mit etwas Wasser in einem Topf aufkochen, Kürbiskerne zugeben und rühren bis der Zucker karamellisiert und flüssig wird. Die Butter unterrühren. Auf die Alufolie gießen und rasch verstreichen. Rohe Rote Bete-Knollen in Salzwasser 40 Min. kochen, abschrecken, schälen & in dünne Scheiben hobeln. Birnen vierteln, Gehäuse entfernen, Fruchtfleisch in dünne Spalten schneiden, in Butter kurz andünsten, herausnehmen. Speck- und Schalottenwürfel in Fett geben, anbraten, herausnehmen. Rest mit Balsamico-Essig ablöschen, Honig und Senf zugeben, mit Salz und Pfeffer würzen. Aus der Pfanne in eine Schüssel geben und das Kürbiskernöl kräftig unterschlagen, abschmecken. Feldsalat im Dressing wenden & mit der Speck-Schalottenmischung bestreuen. Außenrum die Birnenspalten und Rote Bete-Scheiben arrangieren. Den Rest vom Dressing in Streifen darüber träufeln. Krokant in Stücke brechen, auf den Tellern verteilen.",1,30,0,,,"2,3,4"
238,Rote Bete mit Ziegenkäse,Rote Beete,80,g,80,0,0,Parmesan,2,EL,12,0,0,Ziegenfrischkäse,40,Stück,40,0,0,Thymian,1,TL,1,0,0,Olivenöl,2,TL,6,0,0,Kürbiskerne,8,g,8,0,0,Balsamico,"1,5",TL,"7,5",0,0,Kürbiskernöl,1,TL,3,0,0,Rapsöl,2,TL,6,0,0,Jod-Salz,1,Prise,1,0,0,Pfeffer,1,Prise,"0,2",0,0,,0,,0,,,,0,,0,,,,0,,0,,,,0,,0,,,,0,,0,,,,0,,0,,,,0,,0,,,,0,,0,,,,0,,0,,,,,,,,,,,,,,,,,,,,,,,,,,,,,,,,,,,,,,,,,,,,,,,,,,,,,,,,,,,,,,,"Thymianblätter hacken, mit Parmesan vermischen & Rote Bete jeweils quer durchschneiden. Eine ofenfeste Form mit Öl einfetten. Nun Ziegenkäse beidseitig in die Thymian-Parmesanmischung drücken und jeweils auf eine halbe Rote Bete in der Form setzen. Die restliche Parmesanmischung darüber streuen und 13 Min. in auf 180°C vorgeheizten Ofen geben. Zeitgleich Kürbiskerne in der Pfanne rösten. Balsamico, Salz, Pfeffer mit beiden Ölsorten verrühren, Kürbiskerne untermischen. Fertige Rote Bete mit der Sauce beträufeln. Fertig. Guten Appetit!",1,20,15,,,"2,3,4"
239,"Upfit ""Kasseler Auflauf""",Kasseler,100,g,100,0,0,Broccoli,"0,5",Stück,170,0,0,Schmand,4,EL,60,0,0,Sahne,5,EL,65,0,0,Jod-Salz,1,Prise,1,0,0,Pfeffer,1,Prise,"0,2",0,0,,0,,0,,,,0,,0,,,,0,,0,,,,0,,0,,,,0,,0,,,,0,,0,,,,0,,0,,,,0,,0,,,,0,,0,,,,0,,0,,,,0,,0,,,,0,,0,,,,0,,0,,,,0,,0,,,,,,,,,,,,,,,,,,,,,,,,,,,,,,,,,,,,,,,,,,,,,,,,,,,,,,,,,,,,,,,"Fleisch in eine gefettete Auflaufform legen, darauf die Brokkoliröschen (etwas salzen und pfeffern) legen und darauf die Rösti legen. Sahne und Schmand verrühren und über das Ganze gießen. Nun das Ganze für 60 Min. bei 200 °C in den Ofen geben. Nach 30 Min. den Topf mit Alufolie abdecken damit die Rösti nicht verbrennen. Wenn der Brokkoli gar ist, ist das Gericht fertig.",1,10,0,,,"2,3"
240,Carpaccio von Roter Bete mit bunter Beilage,Rote Beete,100,g,100,0,0,Pinienkerne,3,EL,40,0,0,Champignon gegart,1,Stück,98,0,0,Rucola,10,Blatt,2,0,0,Balsamico,1,TL,5,0,0,Olivenöl,1,TL,3,0,0,Parmesan,1,TL,2,0,0,Jod-Salz,1,Prise,1,0,0,Pfeffer,1,Prise,"0,2",0,0,,0,,0,,,,0,,0,,,,0,,0,,,,0,,0,,,,0,,0,,,,0,,0,,,,0,,0,,,,0,,0,,,,0,,0,,,,0,,0,,,,0,,0,,,,,,,,,,,,,,,,,,,,,,,,,,,,,,,,,,,,,,,,,,,,,,,,,,,,,,,,,,,,,,,"Gegarten Rote Bete Knollen in feine Scheiben schneiden und auf dem Teller ausbreiten. Champignons ebenfalls hauchfein schneiden und in die Mitte des Tellers legen. Darauf dann etwas Rucola locker verteilen. In einer trockenen Pfanne die Pinienkerne leicht bräunen und darüber streuen. Ein wenig Balsamessig mit einem Schuss Olivenöl, Salz und Pfeffer verrühren und den Salat damit beträufeln. Oben darauf etwas Parmesan hobeln und servieren. Fertig.",1,30,0,,,"2,3,4"
241,Rote Bete Carpaccio,Rote Beete,125,g,125,0,0,Schalotte,1,Stück,15,0,0,Jod-Salz,1,Prise,1,0,0,Weißweinessig,1,TL,5,0,0,Walnussöl,2,TL,6,0,0,Olivenöl,1,EL,10,0,0,Honig,3,g,3,0,0,Senf,1,Prise,1,0,0,Schwein Speck,15,g,15,0,0,Schnittlauch,1,TL,3,0,0,Haselnuss,2,TL,4,0,0,Parmesan,10,g,10,0,0,Pfeffer,1,Prise,"0,2",0,0,,0,,0,,,,0,,0,,,,0,,0,,,,0,,0,,,,0,,0,,,,0,,0,,,,0,,0,,,,,,,,,,,,,,,,,,,,,,,,,,,,,,,,,,,,,,,,,,,,,,,,,,,,,,,,,,,,,,,"Rote Bete in feine Scheiben schneiden und auf den Tellern auslegen. Salzen. Pfeffern. Schalotten darüber streuen. Essig mit Öl, Honig und Senf verrühren, salzen, pfeffern und über die Rote Beete geben. Speck in sehr feine Streifen schneiden und ohne Fett knusprig braten. Schnittlauch in feine Röllchen schneiden, mit Haselnüssen und Speckstreifen über das Carpaccio streuen, Käse fein hobeln, darüber geben, servieren.",1,30,0,,,"2,3,4"
242,Rote Bete Salat,Rote Beete,125,g,125,0,0,Zwiebel (rot),"0,25",Stück,23,0,0,Walnuss,4,Stück,16,0,0,Apfel,"0,25",Stück,21,0,0,Balsamico,"1,5",TL,"7,5",0,0,Olivenöl,2,TL,6,0,0,Honig,3,g,3,0,0,Meerrettich,"0,5",TL,"0,5",0,0,Jod-Salz,1,Prise,1,0,0,Pfeffer,1,Prise,"0,2",0,0,,0,,0,,,,0,,0,,,,0,,0,,,,0,,0,,,,0,,0,,,,0,,0,,,,0,,0,,,,0,,0,,,,0,,0,,,,0,,0,,,,,,,,,,,,,,,,,,,,,,,,,,,,,,,,,,,,,,,,,,,,,,,,,,,,,,,,,,,,,,,"Rote Bete in feine Scheiben schneiden, rote Zwiebel schälen, in halbe Ringe schneiden und dazugeben. Die Walnüsse knacken und grob hacken, ebenfalls zufügen. Ebenso den in Würfel geschnittenen Apfel mit Balsamico, Olivenöl, Blütenhonig, Meerrettich, Pfeffer und Salz mit einander verrühren und unter die Rote Bete mischen. Bis zum Verzehr im Kühlschrank durchziehen lassen.",1,30,0,,,"2,3,4"
243,Putengeschnetzeltes mit Mascarpone,Pute Brust,170,g,170,0,0,Zucchini,"0,5",Stück,"104,5",0,0,Paprikaschote,"0,5",Stück,"77,5",0,0,Möhre (Karotte),"0,75",Stück,61,0,0,Broccoli,50,g,50,0,0,Mascarpone,85,g,85,0,0,Rapsöl,1,TL,3,0,0,Tomatenmark,2,TL,10,0,0,Jod-Salz,1,Prise,1,0,0,"Magermilch (0,5% Fett)",1,TL,5,0,0,Pfeffer,1,Prise,"0,2",0,0,,0,,0,,,,0,,0,,,,0,,0,,,,0,,0,,,,0,,0,,,,0,,0,,,,0,,0,,,,0,,0,,,,0,,0,,,,,,,,,,,,,,,,,,,,,,,,,,,,,,,,,,,,,,,,,,,,,,,,,,,,,,,,,,,,,,,"Geflügelfleisch in mundgerechte Stücke schneiden und in großer Pfanne im Öl in 10 Min. bei anfangs großer, dann mittlerer Hitze durchbraten. Zerkleinertes Gemüse hinzugeben und in 5 Min. bissfest garen. Nun das Tomatenmark zugeben, kurz anbraten, dann die Mascarpone zugeben. Mit Salz und Pfeffer abschmecken.",1,15,0,,,"2,3"
244,Kartoffel-Brokkoli-Curry,Kartoffel,188,g,188,0,0,Broccoli,125,g,125,0,0,Zwiebel,"0,25",Stück,23,0,0,Olivenöl,2,TL,15,0,0,Kokosmilch,100,ml,100,0,0,Gemüsebrühe,100,ml,100,0,0,Currypaste,"0,5",TL,3,0,0,Rote Linsen,25,g,25,0,0,Jod-Salz,1,Prise,1,0,0,,0,,0,,,,0,,0,,,,0,,0,,,,0,,0,,,,0,,0,,,,0,,0,,,,0,,0,,,,0,,0,,,,0,,0,,,,0,,0,,,,0,,0,,,,,,,,,,,,,,,,,,,,,,,,,,,,,,,,,,,,,,,,,,,,,,,,,,,,,,,,,,,,,,,"Kartoffeln schälen und würfeln. Brokkoli putzen, waschen und in Röschen teilen. Zwiebeln abziehen und fein würfeln. Öl erhitzen, Zwiebel und Kartoffeln kurz anbraten. Currypaste, Kokosmilch und Gemüsebrühe zufügen. Alles zugedeckt 10 Min. köcheln lassen. Brokkoli und Linsen unterrühren und weitere 10 Min. köcheln lassen. Curry abschmecken. Fertig.",1,30,0,,,"2,3"
245,Brokkolisuppe mit Räucherlachs,Zwiebel,"0,5",Stück,46,0,0,Broccoli,315,g,315,0,0,Butter,"1,5",TL,6,0,0,Gemüsebrühe,450,ml,450,0,0,Lachs geräuchert,100,g,100,0,0,Crème fraîche (30% Fett),3,EL,45,0,0,Jod-Salz,1,Prise,1,0,0,Muskatnuss,1,Prise,"0,2",0,0,Pfeffer,1,Prise,"0,2",0,0,,0,,0,,,,0,,0,,,,0,,0,,,,0,,0,,,,0,,0,,,,0,,0,,,,0,,0,,,,0,,0,,,,0,,0,,,,0,,0,,,,0,,0,,,,,,,,,,,,,,,,,,,,,,,,,,,,,,,,,,,,,,,,,,,,,,,,,,,,,,,,,,,,,,,"Zwiebel würfeln, Brokkoli in Röschen teilen und dessen Stiele klein schneiden. Butter in Kochtopf erhitzen, Zwiebelwürfel andünsten, mit Brühe ablöschen und aufkochen. Brokkoli darin 10 Min. garen. Nach 5 Min. einige Röschen herausnehmen, unter kaltem Wasser abschrecken und beiseite legen. Lachs in Streifen schneiden. Broccoli in der Suppe pürieren. Crème Fraîche einrühren und kurz aufkochen lassen. Suppe abschmecken. Zusammen mit Brokkoliröschen und Lachs servieren. Fertig.",1,25,0,,,"2,3"
246,"Upfit ""Leckere Cremesuppe""",Broccoli,100,g,100,0,0,Kartoffel,"0,5",Stück,40,0,0,Zwiebel,"0,25",Stück,23,0,0,Rapsöl,1,TL,3,0,0,Gemüsebrühe,250,ml,250,0,0,"Magermilch (0,5% Fett)",2,EL,30,0,0,Sahne,1,EL,13,0,0,Jod-Salz,1,Prise,1,0,0,Curry,1,Prise,"0,2",0,0,Pfeffer,1,Prise,"0,2",0,0,,0,,0,,,,0,,0,,,,0,,0,,,,0,,0,,,,0,,0,,,,0,,0,,,,0,,0,,,,0,,0,,,,0,,0,,,,0,,0,,,,,,,,,,,,,,,,,,,,,,,,,,,,,,,,,,,,,,,,,,,,,,,,,,,,,,,,,,,,,,,"Brokkoli in kleine Röschen teilen und Kartoffel schälen und ebenfalls würfeln. Topf erhitzen, Öl zugeben und die Zwiebeln glasig anbraten. Gemüse und Kartoffeln zufügen und anschwitzen. Mit heißer Gemüsebrühe ablöschen. Aufkochen, ca. 10 Min. bei geringer Hitze garen. Milch und Crème Legère zugeben und Suppe mit pürieren. Mit Salz, Pfeffer und Curry abschmecken.",1,25,0,,,"2,3"
247,"Upfit ""Blumenkohl-Brokkoli Auflauf""",Broccoli,"0,5",Stück,170,0,0,Blumenkohl,"0,5",Stück,31,0,0,Zwiebel,"0,5",Stück,46,0,0,Schinkenwürfel,65,g,65,0,0,Olivenöl,1,TL,3,0,0,Rind Hackfleisch,200,g,200,0,0,Crème fraîche (30% Fett),"0,5",Becher,100,0,0,Sahne,50,ml,50,0,0,Kräuter (gemischt),5,Prise,1,0,0,geriebener Käse,100,g,100,0,0,Jod-Salz,1,Prise,1,0,0,Paprikapulver,1,Prise,"0,2",0,0,Pfeffer,1,Prise,"0,2",0,0,,0,,0,,,,0,,0,,,,0,,0,,,,0,,0,,,,0,,0,,,,0,,0,,,,0,,0,,,,,,,,,,,,,,,,,,,,,,,,,,,,,,,,,,,,,,,,,,,,,,,,,,,,,,,,,,,,,,,"Brokkoli und Blumenkohl in kleine Röschen teilen und in Wasser 15 Min. kochen, abgießen und beiseite stellen. Zwiebel würfeln und in Pfanne in Öl glasig anbraten, das Hack dazugeben und krümelig anbraten, die Schinkenwürfel dazugeben und mitbraten. Wenn Flüssigkeit fast verdampft ist, die Platte ausmachen und Crème fraîche und Sahne unterrühren. Mit Pfeffer, Salz, Paprikapulver und den Kräutern würzen. Brokkoli und den Blumenkohl in Auflaufform geben und die Hackfleischsoße darauf verteilen. Mit geraspeltem Käse bestreuen und den Auflauf 25 Min. bei 180°C backen.",1,20,0,,,"2,3"
248,Supper mit Brokkoli & Frischkäse,Broccoli,200,g,200,0,0,Gemüsebrühe,150,ml,150,0,0,"Magermilch (0,5% Fett)",60,ml,60,0,0,Frischkäse Doppelrahmstufe,25,g,25,0,0,Zitrone Fruchtsaft,1,TL,5,0,0,Jod-Salz,1,Prise,1,0,0,Muskatnuss,1,Prise,"0,2",0,0,,0,,0,,,,0,,0,,,,0,,0,,,,0,,0,,,,0,,0,,,,0,,0,,,,0,,0,,,,0,,0,,,,0,,0,,,,0,,0,,,,0,,0,,,,0,,0,,,,0,,0,,,,,,,,,,,,,,,,,,,,,,,,,,,,,,,,,,,,,,,,,,,,,,,,,,,,,,,,,,,,,,,"Brokkolistrunk schälen, klein scheiden und Brokkoli in Röschen teilen. Gemüsebrühe zum Kochen bringen. Brokkoli und Milch dazu geben, aufkochen und bei schwacher Hitze 15 Min. kochen lassen. Brokkoli anschließend mit Kochflüssigkeit pürieren. Frischkäse, Zitronensaft, Salz und Muskat hinzufügen. Alles verrühren, nochmals kurz aufkochen lassen und sofort servieren. Guten Appetit!",1,25,0,,,"2,3"
249,"Upfit ""Brokkoliauflauf""",Broccoli,150,g,150,0,0,Jod-Salz,1,Prise,1,0,0,Mehl,1,EL,10,0,0,"Magermilch (0,5% Fett)",75,ml,75,0,0,Gemüsebrühe,75,ml,75,0,0,Muskatnuss,1,Prise,"0,2",0,0,Gouda,25,g,25,0,0,Pfeffer,1,Prise,"0,2",0,0,,0,,0,,,,0,,0,,,,0,,0,,,,0,,0,,,,0,,0,,,,0,,0,,,,0,,0,,,,0,,0,,,,0,,0,,,,0,,0,,,,0,,0,,,,0,,0,,,,,,,,,,,,,,,,,,,,,,,,,,,,,,,,,,,,,,,,,,,,,,,,,,,,,,,,,,,,,,,"Brokkoliröschen 5 MIn. in Salzwasser kochen. Zeitgleich aus Mehl, Milch und Gemüsebrühe eine sämige Sauce kochen und mit Salz, Pfeffer und Muskat abschmecken. Die Sauce etwas abkühlen lassen, den Käse reiben und unterrühren. Die Brokkoliröschen aus dem Wasser heben, abtropfen lassen und in eine gefettete Auflaufform geben. Die Sauce darüber gießen. Den Auflauf im auf 180°C vorgeheizten Ofen auf der mittleren Schiene 30 Min. backen. Fertig. Guten Appetit!",1,20,0,,,"2,3"
250,"Upfit ""Hack mit Brokkoli""",Hackfleisch (gemischt),125,g,125,0,0,Broccoli,250,g,250,0,0,Sahne,"0,5",Becher,100,0,0,Schmand,"0,5",Becher,100,0,0,Eier,1,Stück,58,0,0,geriebener Käse,100,g,100,0,0,Jod-Salz,1,Prise,1,0,0,Pfeffer,1,Prise,"0,2",0,0,,0,,0,,,,0,,0,,,,0,,0,,,,0,,0,,,,0,,0,,,,0,,0,,,,0,,0,,,,0,,0,,,,0,,0,,,,0,,0,,,,0,,0,,,,0,,0,,,,,,,,,,,,,,,,,,,,,,,,,,,,,,,,,,,,,,,,,,,,,,,,,,,,,,,,,,,,,,,"Das Hackfleisch würzen und anbraten. Den Brokkoli in Röschen teilen und in Salzwasser bissfest kochen lassen. Das Hackfleisch und den Brokkoli in eine gefettete Auflaufform schichten. Sahne mit Schmand, Ei, Käse und den Gewürzen verrühren. Die Soße über das Hackfleisch bzw. Brokkoli gießen, den Auflauf mit Alufolie abdecken und 30 Min. bei 180 °C überbacken.",1,30,30,,,"2,3"
251,Herzhafte Brokkolicremesuppe,Broccoli,100,g,150,0,0,Wasser,125,ml,125,0,0,Sahne,6,EL,60,0,0,Hühnerbrühe/- boullion gekörnt,125,ml,125,0,0,Jod-Salz,1,Prise,1,0,0,Mehl,5,TL,15,0,0,Butter,1,EL,10,0,0,Frühlingszwiebel,"0,5",Stück,"22,5",0,0,,0,,0,,,,0,,0,,,,0,,0,,,,0,,0,,,,0,,0,,,,0,,0,,,,0,,0,,,,0,,0,,,,0,,0,,,,0,,0,,,,0,,0,,,,0,,0,,,,,,,,,,,,,,,,,,,,,,,,,,,,,,,,,,,,,,,,,,,,,,,,,,,,,,,,,,,,,,,"Brokkoli 5 Min. in Salzwasser blanchieren & abkühlen lassen. Butter erhitzen und fein geschnittene Zwiebel anrösten, das Mehl dazu geben und zur hellen Mehlschwitze köcheln. Brokkoli mit Kochwasser und Brühe dazurühren, einmal kurz aufkochen und mit dem Mixstab pürieren, Sahne, Salz und Pfeffer dazugeben umrühren und kosten.",1,15,0,,,"2,3"
252,Brokkoli-Tofu Pfanne mit Erdnusssoße,Erdnuss geröstet,25,g,25,0,0,Erdnussbutter,1,TL,4,0,0,Zucker braun,1,Prise,1,0,0,Currypaste,1,g,1,0,0,Kokosmilch,100,ml,100,0,0,Sahne,25,ml,25,0,0,Sojasauce,"0,5",TL,"2,5",0,0,Broccoli,200,g,200,0,0,Frühlingszwiebel,1,Stück,45,0,0,Tofu,100,g,100,0,0,Olivenöl,"1,5",EL,15,0,0,Gemüsebrühe,25,ml,25,0,0,,0,,0,,,,0,,0,,,,0,,0,,,,0,,0,,,,0,,0,,,,0,,0,,,,0,,0,,,,0,,0,,,,,,,,,,,,,,,,,,,,,,,,,,,,,,,,,,,,,,,,,,,,,,,,,,,,,,,,,,,,,,,"Zucker bei mittlerer Hitze karamellisieren, Currypaste einrühren, Erdnussbutter, grob zerkleinerte Erdnüsse, Kokosmilch und etwas Wasser zugeben. Aufkochen, die Sahne zugeben und offen 10 Min. einkochen lassen. Zum Schluss mit Sojasoße würzen. Die Frühlingszwiebeln in schräge Scheiben schneiden, den Tofu würfeln. Öl im Wok erhitzen, den Tofu braten. Nun auf Küchenpapier abtropfen lassen. Öl erhitzen und den Brokkoli 4 Min. bei starker Hitze braten, nun mit der Gemüsebrühe ablöschen. Bei mittlerer Hitze 3 Min. garen. Tofu und Zwiebeln unterrühren, mit Sojasoße abschmecken und 2 Min. weitergaren. Die Erdnusssoße mit dem Gemüse anrichten.",1,30,0,,,"2,3"
253,"Upfit ""Sesam-Brokkoli Geflügel""",Hähnchen (Brust),170,g,170,0,0,Jod-Salz,2,Prise,2,0,0,Sojasauce,1,Prise,1,0,0,Mais Stärke,1,EL,10,0,0,Hühnerei Eiklar,1,Stück,30,0,0,Broccoli,85,g,85,0,0,Sesamöl,2,EL,6,0,0,Knoblauchzehe,"0,25",Zehe,1,0,0,Frühlingszwiebel,"1,5",Stück,67,0,0,Sojasauce,2,TL,10,0,0,Honig,1,EL,18,0,0,Sesam,1,EL,12,0,0,,0,,0,,,,0,,0,,,,0,,0,,,,0,,0,,,,0,,0,,,,0,,0,,,,0,,0,,,,0,,0,,,,,,,,,,,,,,,,,,,,,,,,,,,,,,,,,,,,,,,,,,,,,,,,,,,,,,,,,,,,,,,"In einer Schüssel, Honig, Sesamsamen, einen Sojasauce und Knoblauch vermengen und zur Seite stellen. In weiterer Schüssel Eiweiß, Salz, Sojasauce und Speisestärke vermengen. Geflügel in Streifen schneiden, dazugeben und vermengen. Sesamöl in einem Wok bei mittelstarker Hitze heiß werden lassen und mariniertes Geflügel dazugeben. Unter stetigem Rühren das Fleisch 8 Min. braten. Zeitgleich die Brokkoliröschen in kochendem Wasser 7 Min. bissfest kochen. Nun kleingeschnittene Lauchzwiebeln und die Honig-Sojasauce über das Fleisch geben. Nun den abgetropften Brokkoli in den Wok geben. Alles vermengen, 1 Min. aufkochen lassen und zu Basmatireis servieren.",1,15,20,,,"2,3"
254,Brokkolisuppe,Broccoli,125,g,125,0,0,Kartoffel,"0,5",Stück,40,0,0,Gemüsebrühe,250,ml,250,0,0,Jod-Salz,1,Prise,1,0,0,,0,,0,0,0,Pfeffer,1,Prise,1,0,0,,0,,0,,,,0,,0,,,,0,,0,,,,0,,0,,,,0,,0,,,,0,,0,,,,0,,0,,,,0,,0,,,,0,,0,,,,0,,0,,,,0,,0,,,,0,,0,,,,0,,0,,,,0,,0,,,,,,,,,,,,,,,,,,,,,,,,,,,,,,,,,,,,,,,,,,,,,,,,,,,,,,,,,,,,,,,"Kartoffeln in kleine Stücke schneiden, Brokkoli und Kartoffelstücke 20 Min. in Brühe köcheln lassen. Nun alles pürieren und danach wieder in den Topf zurückgeben und erneut erwärmen. Dann mit Salz und Pfeffer abschmecken. Fertig.",1,25,30,,,"2,3"
255,"Upfit ""Gemischtes Ofengemüse""",Gemüse,250,g,250,0,0,Olivenöl,2,TL,6,0,0,Thymian,1,Prise,"0,2",0,0,Jod-Salz,1,Prise,1,0,0,Pfeffer schwarz,1,Prise,"0,2",0,0,,0,,0,,,,0,,0,,,,0,,0,,,,0,,0,,,,0,,0,,,,0,,0,,,,0,,0,,,,0,,0,,,,0,,0,,,,0,,0,,,,0,,0,,,,0,,0,,,,0,,0,,,,0,,0,,,,0,,0,,,,,,,,,,,,,,,,,,,,,,,,,,,,,,,,,,,,,,,,,,,,,,,,,,,,,,,,,,,,,,,"Kartoffeln, Paprika, Fenchel vierteln. Möhren, Zwiebeln und Tomaten halbieren. Blumenkohl und Brokkoli in Röschen teilen und Stiele zweifach einschneiden. Zucchini, Auberginen, Kohlrabi, Sellerie, Lauch in Abschnitte oder 3 cm dicke Scheiben schneiden. Vorbereitetes Gemüse auf ein mit Öl beträufeltes Backblech verteilen. Mit Thymian, Pfeffer und Salz bestreuen und in der Mitte des auf 200°C vorgeheizten Ofens 35 Minuten garen. Weiches Gemüse wie Tomaten oder Aubergine evtl. nur 20 Minuten mitbacken.",1,25,35,,,"2,3"
256,Rote Bete-Salat mit Ziegenkäse-Crostini,Baguette,75,g,75,0,0,Olivenöl,"3,5",EL,35,0,0,Ziegenkäse,50,g,50,0,0,Rosmarin,1,TL,1,0,0,Zitrone Fruchtsaft,1,EL,15,0,0,Senf,"0,5",TL,3,0,0,Honig,1,EL,18,0,0,Jod-Salz,1,Prise,1,0,0,Rote Beete,150,g,150,0,0,Apfel,"0,5",Stück,43,0,0,Rucola,20,g,20,0,0,Pfeffer,1,Prise,"0,2",0,0,,0,,0,,,,0,,0,,,,0,,0,,,,0,,0,,,,0,,0,,,,0,,0,,,,0,,0,,,,0,,0,,,,,,,,,,,,,,,,,,,,,,,,,,,,,,,,,,,,,,,,,,,,,,,,,,,,,,,,,,,,,,,"Brotscheiben auf ein Blech legen und Öl beträufeln. Nun mit geschnittenem Ziegenkäse belegen und mit Rosmarin bestreuen. Jeweils etwas Honig über den Käse träufeln. Zitronensaft mit 2 EL Wasser, Senf, etwas Honig, Salz und Pfeffer verrühren. Öl nach und nach unterrühren. Rote Bete halbieren und in Scheiben schneiden. Apfel in Scheiben schneiden und würfeln. Ziegenkäsebrote im auf 220°C vorgeheizten Ofen auf der mittleren Schiene 10 Min. backen. Rote Bete, Apfel und Rauke mit dem Honig-Senfdressing mischen. Mit den gratinierten Ziegenkäsebroten servieren.",1,30,10,,,"3,4"
257,"Upfit ""Rote Bete-Curry""",Rote Beete,125,g,125,0,0,grüne Peperoni (roh),"0,5",Stück,"7,5",0,0,Curry,3,Prise,"0,6",0,0,Zwiebel,"0,25",Stück,23,0,0,,0,,0,0,0,Zucker,1,Prise,1,0,0,Knoblauchzehe,"0,25",Zehe,1,0,0,Kokosmilch,100,ml,100,0,0,Kurkuma,1,Prise,"0,2",0,0,Olivenöl,1,TL,3,0,0,Zimt,3,g,3,0,0,Kardamon,2,g,2,0,0,Nelkenpulver,"0,5",TL,"0,5",0,0,Jod-Salz,1,Prise,1,0,0,Curry,1,TL,1,0,0,Pfeffer,1,Prise,"0,2",0,0,,0,,0,,,,0,,0,,,,0,,0,,,,0,,0,,,,,,,,,,,,,,,,,,,,,,,,,,,,,,,,,,,,,,,,,,,,,,,,,,,,,,,,,,,,,,,"Die Rote Bete mit dem grünen Chili, Currypulver, Salz, Zucker, Knoblauch und Kurkuma gut durchmischen und etwas ziehen lassen. Zwiebeln in Öl anbraten. Zimtstange, Kardamom, Nelken dazugeben und braten, bis die Gewürze duften. Curry dazugeben. Rote Bete untermischen und mit der Hälfte der Kokosmilch ablöschen. Im offenen Topf 13 Min. köcheln, bis die Rote Bete gar ist und die Kokosmilch eingekocht. Die restliche Kokosmilch dazugeben, abschmecken und erneut aufkochen.",1,20,0,,,"2,3,4"
258,Cremige Rote Bete-Möhren Suppe,Rote Beete,150,g,150,0,0,Möhre (Karotte),75,g,75,0,0,Zwiebel,"0,25",Stück,23,0,0,Olivenöl,2,TL,6,0,0,Gemüsebrühe,250,ml,250,0,0,Kartoffel,120,g,120,0,0,Sellerie,"0,25",Stück,16,0,0,Meerrettich,1,TL,5,0,0,Pfeffer,1,Prise,"0,2",0,0,,0,,0,,,,0,,0,,,,0,,0,,,,0,,0,,,,0,,0,,,,0,,0,,,,0,,0,,,,0,,0,,,,0,,0,,,,0,,0,,,,0,,0,,,,,,,,,,,,,,,,,,,,,,,,,,,,,,,,,,,,,,,,,,,,,,,,,,,,,,,,,,,,,,,"Rote Bete und Möhren in kleine Stücke schneiden, die Kartoffeln schälen und würfeln, die Zwiebel schälen und klein schneiden. Zwiebel in Öl anbraten, etwas Sellerie dazu geben. Das klein geschnittene Gemüse zufügen und etwas anschwitzen. Das Ganze mit Gemüsebrühe aufgießen und garen. Nun mit den Gewürzen abschmecken. Alles mit Meerrettich abschmecken. Tipp: Du kannst Meerrettich auch weggelassen. Guten Appetit!",1,15,20,,,"2,3"
